{
  "$schema": "./current-work.schema.json",
  "schema_version": "1.0",
  "status": "completed",
  "selected_at": "2026-10-17T07:14:50Z",
  "updated_at": "2026-10-17T08:21:16Z",
  "roadmap_basis": [
    {
      "path": "family-office-engine/docs/roadmap/roadmap-v4b-work-transition.md",
      "section": "V4.14y — Annex VIII Part 2 versioned catalogue and temporal ledger",
      "reason": "V4.14x evento 2 ha dato NO-GO limitato: la candidata non include tutte le entry/ledger temporali. V4.14y abilita un catalogo documentale completo senza modificare runtime o rules."
    }
  ],
  "increment": {
    "id": "V4.14y-annex-viii-part2-versioned-catalogue",
    "title": "Annex VIII Part 2 versioned catalogue and temporal ledger",
    "objective": "Produrre e sottoporre a review una tabella completa delle entry testuali dell'Annex VIII Part 2 con ledger degli atti autentici, delta e intervalli di efficacia; mantenere fuori scope l'applicabilità territoriale non verificata.",
    "scope": [
      "Riconciliare le 23 entry/sub-entry testuali del consolidato EUR-Lex 02004R0883-20190731 con gli atti GUUE 988/2009, 1244/2010, 1224/2012, 517/2013, 1372/2013 e 2017/492.",
      "Registrare per ogni delta CELEX, OJ, pagina/articolo, operation, effective date, entry key locale e valid_from/valid_to supportati.",
      "Distinguere entry testuali da schemi nazionali; mantenere UK, SEE e Svizzera in ambito separato non valutato.",
      "Registrare entrambi i nuovi Knowledge document nel citation catalog e aggiornare il test del conteggio corpus, senza waivare il gap di citazione atteso per altri documenti.",
      "Sottoporre candidate source table e ledger a review normativa indipendente exact-version entro due eventi massimi."
    ],
    "out_of_scope": [
      "Aggiornare rule pack o runtime, effettuare match su schemi individuali o usare dati personali.",
      "Determinare l'applicabilità post-Brexit o l'estensione SEE/Svizzera.",
      "Sbloccare V4.14w/V4.14a/V4.15 o la timeline pensionistica complessiva."
    ],
    "candidate_files": [
      "family-office-knowledge/international/eu-annex-viii-part-2-catalogue-candidate-v0.1.md",
      "family-office-knowledge/international/eu-pension-art57-evidence-binding-audit-candidate-v0.18.md",
      "family-office-knowledge/sources/citation-catalog.json",
      "family-office-engine/tests/unit/test_citation_index.py",
      "family-office-engine/docs/current-next-increment.md",
      "family-office-engine/docs/roadmap/roadmap-v4b-work-transition.md",
      "family-office-engine/docs/decision-log.md",
      "family-office-bootstrap/planning/current-work.json"
    ],
    "stop_condition": "Se un entry/delta o un intervallo di efficacia non è dimostrato da un atto autentico, registrarne il gap e non renderlo matchabile; nessuna modifica a Rules/Engine."
  },
  "verification": {
    "tests": [
      "Roadmap audit prima della selezione: OK, current=V4.14b, functional_since_audit=0, audit_due=false.",
      "Verificare ledger e conteggio entry/sub-entry contro testo consolidato e singoli atti GUUE; review exact-version necessaria.",
      "Test mirato citation index 6/6 dopo l'indicizzazione; conteggio documenti atteso aggiornato 16→18.",
      "Suite Engine completa dopo aggiornamento documentale citation index: 774 test, 0 failure, 0 errori, 0 skipped.",
      "Schema planner, roadmap audit, execution guardrails e git diff --check: tutti superati."
    ],
    "documentation_touchpoints": [
      "family-office-knowledge/international/eu-annex-viii-part-2-catalogue-candidate-v0.1.md",
      "family-office-knowledge/sources/citation-catalog.json",
      "family-office-engine/tests/unit/test_citation_index.py",
      "family-office-engine/docs/current-next-increment.md",
      "family-office-engine/docs/roadmap/roadmap-v4b-work-transition.md",
      "family-office-engine/docs/decision-log.md",
      "family-office-bootstrap/planning/current-work.json"
    ],
    "result": "passed",
    "notes": "V4.14w resta blocked dopo NO-GO evento 11. V4.14x resta blocked dopo NO-GO evento 2: v0.18 non contiene il catalogo e ledger completi. V4.14y è documentale/source-only. L'evento 2 ha dato NO-GO alla versione pre-fix ma ha esplicitamente autorizzato GO-after-fix limitato ai documenti applicando dieci correzioni finite; applicate senza ulteriore review. Rules/runtime restano non approvati. Il finding Art.1(27) vs Art.1(16) resta registrato, non corretto qui.",
    "task_envelope": {
      "mode": "normative-change",
      "risk_domain": "pension",
      "objective": "Costruire un catalogo storico Annex VIII Part 2 documentale, completo e source-bound per l'approvazione futura.",
      "repositories": ["family-office-knowledge", "family-office-engine", "family-office-bootstrap"],
      "read_set": [
        "EUR-Lex 02004R0883-20190731 Annex VIII Part 2",
        "EUR-Lex/OJ acts 32009R0988, 32010R1244, 32012R1224, 32013R0517, 32013R1372, 32017R0492",
        "family-office-knowledge/international/eu-annex-viii-part-2-catalogue-candidate-v0.1.md",
        "family-office-knowledge/sources/citation-catalog.json",
        "family-office-engine/tests/unit/test_citation_index.py",
        "family-office-rules/cross-border/eu-pension-coordination-it-es.json"
      ],
      "write_set": [
        "family-office-knowledge/international/eu-annex-viii-part-2-catalogue-candidate-v0.1.md",
        "family-office-knowledge/sources/citation-catalog.json",
        "family-office-engine/tests/unit/test_citation_index.py",
        "family-office-engine/docs/current-next-increment.md",
        "family-office-engine/docs/roadmap/roadmap-v4b-work-transition.md",
        "family-office-engine/docs/decision-log.md",
        "family-office-bootstrap/planning/current-work.json"
      ],
      "test_command": "python family-office-engine/src/family_office_engine/governance/roadmap_audit.py; family-office-engine/.venv/Scripts/python.exe -m jsonschema -i family-office-bootstrap/planning/current-work.json family-office-bootstrap/planning/current-work.schema.json; python family-office-bootstrap/planning/validate-execution-guardrails.py; git diff --check",
      "stop_conditions": [
        "No personal data, individual scheme classification, or rule-pack/runtime edits.",
        "Do not infer legal applicability from a consolidated text alone; unresolved effective dates remain gaps.",
        "Maximum two substantial events for this increment; no extra review without a new roadmap selection."
      ]
    }
  },
  "blockers": [],
  "session_notes": [
    "2026-10-17: V4.14x event 2/2 reviewer NO-GO limited; exact findings in decision log. Started V4.14y per roadmap; no runtime/rule/workspace edits.",
    "2026-10-17: event 1/2 read-only source review completed. Candidate corrected for ledger fields, OJ locators, entry/applicability dates, historical AT-a/SE entries and exact HR legal references.",
    "2026-10-17: event 2/2 completed with NO-GO pre-fix; reviewer explicitly authorized document-only GO-after-fix after ten listed row corrections, no further review. Applied only those changes; no runtime/rule approval.",
    "2026-10-17: full suite initially exposed unindexed Knowledge docs; citation catalog and corpus test updated; targeted citation-index suite 6/6 passes. Final full suite 774/0/0/0 and governance gates passed; V4.14y closed as document-only GO-after-fix.",
    "Prior V4.14w code commit 8009672 was pushed to origin/main before this documentation work."
  ],
  "next_action": {
    "mode": "recalculate",
    "description": "V4.14y is closed as document-only GO-after-fix. Recalculate the next eligible roadmap increment; preserve V4.14w as blocked and do not infer runtime approval."
  },
  "routing": {
    "policy_version": "3.1",
    "tier": "critical",
    "task_class": "normative",
    "agent": "fo_normative_reviewer",
    "model": "gpt-5.6-sol",
    "reasoning_effort": "xhigh",
    "rationale": "Catalogo pensionistico normativo versionato; ogni entry e validità devono essere provate contro atti GUUE, con review specialista e nessuna assunzione territoriale.",
    "trace": [
      {
        "at": "2026-10-17T07:14:50Z",
        "event": "selected",
        "tier": "critical",
        "agent": "fo_normative_reviewer",
        "model": "gpt-5.6-sol",
        "reasoning_effort": "xhigh",
        "reason": "V4.14y selezionato dopo il NO-GO della specifica v0.18; route critico per catalogo/versioning Annex VIII Part 2 e source ledger."
      },
      {
        "at": "2026-10-17T07:17:19Z",
        "event": "delegated",
        "tier": "critical",
        "agent": "fo_normative_reviewer",
        "model": "gpt-5.6-sol",
        "reasoning_effort": "xhigh",
        "reason": "Event 1/2 read-only verification of each Annex VIII Part 2 amendment, OJ page/article, effective date, and exact catalogue entries; 5-minute bound; no edits."
      },
      {
        "at": "2026-10-17T07:20:46Z",
        "event": "reviewed",
        "tier": "critical",
        "agent": "fo_normative_reviewer",
        "model": "gpt-5.6-sol",
        "reasoning_effort": "xhigh",
        "reason": "Event 1 confirmed amendment chain and dates; identified candidate corrections, all applied before final review."
      },
      {
        "at": "2026-10-17T07:20:46Z",
        "event": "delegated",
        "tier": "critical",
        "agent": "fo_normative_reviewer",
        "model": "gpt-5.6-sol",
        "reasoning_effort": "xhigh",
        "reason": "Event 2/2 final read-only exact-version review of corrected Annex VIII candidate v0.1 and temporal ledger; maximum 5 minutes; no edits."
      },
      {
        "at": "2026-10-17T07:30:15Z",
        "event": "reviewed",
        "tier": "critical",
        "agent": "fo_normative_reviewer",
        "model": "gpt-5.6-sol",
        "reasoning_effort": "xhigh",